{
  "access_links": [
    {
      "kind": "portal",
      "label": "dati.gov.it dataset page",
      "url": "https://www.dati.gov.it/view-dataset?id=635fb0ea-b5dc-40c7-89ef-d2d83cbf533e"
    },
    {
      "kind": "api",
      "label": "CKAN package metadata",
      "url": "https://www.dati.gov.it/opendata/api/3/action/package_show?id=635fb0ea-b5dc-40c7-89ef-d2d83cbf533e"
    }
  ],
  "access_restrictions": "none",
  "continents": [
    "europe"
  ],
  "cost": "free",
  "countries": [
    "IT"
  ],
  "data_family": [
    "system_description"
  ],
  "data_kind": [
    "tabular"
  ],
  "date_catalogued": "2026-09-29",
  "date_verified": "2026-10-01",
  "dedupe_keys": {
    "name": "trasporto pubblico locale orari servizio estivo 2014",
    "url": "https://dati.gov.it/view-dataset?id=635fb0ea-b5dc-40c7-89ef-d2d83cbf533e"
  },
  "description": "Trasporto Pubblico Locale Orari Servizio Estivo 2014 is a dataset listed in Italian national open data portal, an open data portal, published or maintained by Regione Puglia. Fermate e orari del servizio estivo anno 2014 del Trasporto Pubblico Locale della Città di Lecce. Coverage: Regione Puglia. The portal files it under the publisher Regione Puglia. Its tags are bus, fermate, orari-estivi, tpl. It offers 1 resource(s) in XLSX. The portal shows 2026-09-28 as the last metadata change. It is reached through the links recorded on this page, with the catalogue entry as the discovery route. Access is free of charge and open. The licence is CC-BY-4.0. Caveats: this record was written from the catalogue listing only, so the linked page was not opened, its contents and current availability were not checked, and the description may lag the source. It can support public transport network, service and demand studies. Related record: the catalogue-level record data-ckan-it-portal.",
  "description_checked": "2026-09-29",
  "discovery_routes": [
    {
      "date": "2026-09-29",
      "query": "CKAN package_search with infrastructure phrases, title names an infrastructure element",
      "route": "R02",
      "source": "dati.gov.it-ckan-api"
    }
  ],
  "formats": [
    "spreadsheet"
  ],
  "geographic_scope": "regional",
  "homepage": "https://www.dati.gov.it/view-dataset?id=635fb0ea-b5dc-40c7-89ef-d2d83cbf533e",
  "id": "data-ckan-it-trasporto-pubblico-locale-orari-servizio-estivo-2014",
  "languages": [
    "it"
  ],
  "last_updated": "2026-09-28",
  "licence": "CC-BY-4.0",
  "licence_type": [
    "attribution"
  ],
  "link_health": {
    "checked": "2026-10-01"
  },
  "maturity": "active",
  "name": "Trasporto Pubblico Locale Orari Servizio Estivo 2014",
  "notes": "Harvested from the dati.gov.it CKAN API on 2026-09-29 as part of the third portal harvest.",
  "provider": "Regione Puglia",
  "regions": [
    "Regione Puglia"
  ],
  "related_ids": [
    "data-ckan-it-portal"
  ],
  "sectors": [
    "transport.public_transit"
  ],
  "simulation_uses": [
    "network_flow"
  ],
  "sources": [
    {
      "accessed": "2026-09-29",
      "note": "dati.gov.it catalogue entry read through the CKAN API on 2026-09-29: title, description, tags, licence, formats, dates; the data files were not opened",
      "url": "https://www.dati.gov.it/opendata/api/3/action/package_show?id=635fb0ea-b5dc-40c7-89ef-d2d83cbf533e"
    }
  ],
  "tags": [
    "Italian national open data portal",
    "bus",
    "fermate",
    "orari-estivi",
    "tpl"
  ],
  "title_en": "Local Public Transport Summer Service Schedules 2014",
  "type": "data"
}
