{
  "access_links": [
    {
      "kind": "api",
      "label": "Service (WMS_SRVC)",
      "url": "https://services.bgr.de/wms/inspire_ge/inspee_ds/"
    },
    {
      "kind": "portal",
      "label": "Publisher landing page",
      "url": "https://data.europa.eu/data/datasets/2846c07b-16a3-4b6a-9d1e-df6e45c545ed?locale=en"
    }
  ],
  "access_restrictions": "none",
  "continents": [
    "europe"
  ],
  "cost": "free",
  "countries": [
    "DE"
  ],
  "data_family": [
    "planning_regulatory_documents"
  ],
  "data_kind": [
    "asset_inventory"
  ],
  "date_catalogued": "2026-09-30",
  "date_verified": "2026-10-01",
  "dedupe_keys": {
    "name": "information system salt planning basis selection criteria and estimation of the potential for the construction of salt caverns for storing renewable energies hydrogen and compressed air double saline and flat salt layers inspee ds wms",
    "url": "https://data.europa.eu/data/datasets/2846c07b-16a3-4b6a-9d1e-df6e45c545ed?locale=en"
  },
  "description": "Information system salt: planning basis, selection criteria and estimation of the potential for the construction of salt caverns for storing renewable energies (hydrogen and compressed air) - double saline and flat salt layers (InSpEE-DS) (WMS) is a dataset listed in EGDI Metadata Catalogue, a catalogue harvested into the European data portal, published or maintained by services.bgr.de. Which salt formations are suitable for storing hydrogen or compressed air? In the InSpEE-DS research project, scientists developed requirements and criteria for the assessment of suitable sites even if their exploration is still at an early stage and there is little knowledge of the salinaries’ structures. Coverage: Europe. Its keywords include inspireidentifiziert, Keuper, Energiespeicher, Deutschland, Kavernen, Erneuerbare Energien. The listing shows 1 download or service links in WMS. It is reached through the links recorded on this page, with the catalogue entry as the discovery route. Access is free of charge and open. The licence is not stated on the portal listing (dataset page not read). Caveats: this record was written from the catalogue listing only, so the linked page was not opened, its contents and current availability were not checked, and the description may lag the source. It can support energy network and generation-capacity studies. Related record: the catalogue-level record data-eu-geology-cz.",
  "description_checked": "2026-09-30",
  "discovery_routes": [
    {
      "date": "2026-09-30",
      "query": "multilingual title search of the catalogue",
      "route": "R02",
      "source": "data.europa.eu-hub-search-api"
    }
  ],
  "formats": [
    "ogc_map_service"
  ],
  "geographic_scope": "regional",
  "homepage": "https://data.europa.eu/data/datasets/2846c07b-16a3-4b6a-9d1e-df6e45c545ed?locale=en",
  "id": "data-geology-cz-information-system-salt-planning-basis-selection-criteria-and",
  "languages": [
    "en"
  ],
  "last_updated": "2023-02-27",
  "licence": "not stated on the portal listing (dataset page not read)",
  "licence_type": [
    "not_stated"
  ],
  "link_health": {
    "checked": "2026-10-01",
    "unverified": [
      "https://services.bgr.de/wms/inspire_ge/inspee_ds/"
    ]
  },
  "maturity": "stale",
  "name": "Information system salt: planning basis, selection criteria and estimation of the potential for the construction of salt caverns for storing renewable energies (hydrogen and compressed air) - double saline and flat salt layers (InSpEE-DS) (WMS)",
  "notes": "Found by the Europe country search on 2026-09-30: title in the original language names an infrastructure element or a natural hazard.",
  "provider": "services.bgr.de",
  "related_ids": [
    "data-eu-geology-cz"
  ],
  "sectors": [
    "energy.gas_hydrogen"
  ],
  "simulation_uses": [
    "capacity_planning"
  ],
  "sources": [
    {
      "accessed": "2026-09-30",
      "note": "EGDI Metadata Catalogue entry read through the European data portal search API on 2026-09-30: title, description, keywords, licence, dates and links; the data files were not opened",
      "url": "https://metadata.europe-geology.eu"
    }
  ],
  "tags": [
    "EGDI Metadata Catalogue",
    "gas"
  ],
  "title_en": "Information system salt: planning basis, selection criteria and estimation of the potential for the construction of salt caverns for storing renewable energies (hydrogen and compressed air) - double saline and flat salt layers (InSpEE-DS) (WMS)",
  "type": "data"
}
