{
  "access_links": [
    {
      "kind": "portal",
      "label": "Public Data Portal (data.go.kr) dataset page",
      "url": "https://www.data.go.kr/data/15074077/fileData.do"
    }
  ],
  "access_restrictions": "none",
  "continents": [
    "asia"
  ],
  "cost": "free",
  "countries": [
    "KR"
  ],
  "data_family": [
    "system_description"
  ],
  "data_kind": [
    "tabular"
  ],
  "date_catalogued": "2026-09-30",
  "date_verified": "2026-09-30",
  "dedupe_keys": {
    "name": "경상남도 양산시 상수도 시설물 현황 drinking water supply",
    "url": "https://data.go.kr/data/15074077/fileData.do"
  },
  "description": "경상남도 양산시_상수도 시설물 현황 [drinking water supply] is a dataset listed in Public Data Portal of Korea (data.go.kr), an open data portal, published or maintained by 경상남도 양산시. 2013년 이후 경상남도 양산시 상수도 시설물 현황 통계를 확인할 수 있습니다. Coverage: 경상남도 양산시. The portal files it under the publisher 경상남도 양산시. Its tags are 연도별, 상수도, 시설, 환경기상. It offers 1 resource(s) in csv. The portal shows 2021-10-13 as the last metadata change. The title and description are in Korean; the topic words in square brackets are the cataloguer's translation of the title. It is reached through the links recorded on this page, with the catalogue entry as the discovery route. Access is free of charge and open. The licence is not stated on the portal listing (dataset page not read). Caveats: this record was written from the catalogue listing only, so the linked page was not opened, its contents and current availability were not checked, and the description may lag the source. It can support drinking water network studies. Related record: the catalogue-level record data-kr-dgk-portal.",
  "description_checked": "2026-09-30",
  "discovery_routes": [
    {
      "date": "2026-09-30",
      "query": "data.go.kr file-data and open-API search pages with Korean infrastructure and hazard phrases",
      "route": "R02",
      "source": "Public Data Portal (data.go.kr)-ckan-api"
    }
  ],
  "formats": [
    "csv"
  ],
  "geographic_scope": "city",
  "homepage": "https://www.data.go.kr/data/15074077/fileData.do",
  "id": "data-kr-dgk-15074077",
  "languages": [
    "ko"
  ],
  "last_updated": "2021-10-13",
  "licence": "not stated on the portal listing (dataset page not read)",
  "licence_type": [
    "not_stated"
  ],
  "maturity": "stale",
  "name": "경상남도 양산시_상수도 시설물 현황 [drinking water supply]",
  "notes": "Harvested from the Public Data Portal (data.go.kr) public search pages on 2026-09-30 as part of the Asia-Pacific country search.",
  "provider": "경상남도 양산시",
  "regions": [
    "경상남도 양산시"
  ],
  "related_ids": [
    "data-kr-dgk-portal"
  ],
  "sectors": [
    "water.drinking_water"
  ],
  "simulation_uses": [
    "network_flow"
  ],
  "sources": [
    {
      "accessed": "2026-09-30",
      "note": "Public Data Portal (data.go.kr) catalogue entry read through the public search pages on 2026-09-30: title, description, tags, licence, formats, dates; the data files were not opened",
      "url": "https://www.data.go.kr/data/15074077/fileData.do"
    }
  ],
  "tags": [
    "Public Data Portal of Korea (data.go.kr)",
    "연도별",
    "상수도",
    "시설",
    "환경기상"
  ],
  "title_en": "Gyeongsangnam-do Yangsan City: Status of Water Supply Facilities",
  "type": "data"
}
