{
  "access_links": [
    {
      "kind": "portal",
      "label": "Taiwan Government Open Data Platform dataset page",
      "url": "https://data.gov.tw/dataset/160482"
    }
  ],
  "access_restrictions": "none",
  "continents": [
    "asia"
  ],
  "cost": "free",
  "countries": [
    "TW"
  ],
  "data_family": [
    "system_description"
  ],
  "data_kind": [
    "tabular"
  ],
  "date_catalogued": "2026-09-30",
  "date_verified": "2026-10-01",
  "dedupe_keys": {
    "name": "高雄市政府消防局地下式消防栓 fire police and emergency services and drinking water supply",
    "url": "https://data.gov.tw/dataset/160482"
  },
  "description": "高雄市政府消防局地下式消防栓 [fire, police and emergency services and drinking water supply] is a dataset listed in Government Open Data Platform of Taiwan (data.gov.tw), an open data portal, published or maintained by 高雄市政府消防局. 提供高雄市政府消防局地下式消防栓. Coverage: 高雄市政府消防局. The portal files it under the publisher 高雄市政府消防局. Its tags are 生活安全及品質. It offers 1 resource(s) in json, csv. The portal shows 2025-09-17 as the last metadata change. The title and description are in Chinese; the topic words in square brackets are the cataloguer's translation of the title. It is reached through the links recorded on this page, with the catalogue entry as the discovery route. Access is free of charge and open. The licence is 政府資料開放授權條款-第1版. Caveats: this record was written from the catalogue listing only, so the linked page was not opened, its contents and current availability were not checked, and the description may lag the source. Suitability for infrastructure simulation has not been checked. Related record: the catalogue-level record data-tw-dgt-portal.",
  "description_checked": "2026-09-30",
  "discovery_routes": [
    {
      "date": "2026-09-30",
      "query": "bulk catalogue export of data.gov.tw (dataset list with descriptions) filtered on infrastructure and hazard words in Chinese",
      "route": "R02",
      "source": "Taiwan Government Open Data Platform-ckan-api"
    }
  ],
  "formats": [
    "json",
    "csv"
  ],
  "geographic_scope": "regional",
  "homepage": "https://data.gov.tw/dataset/160482",
  "id": "data-tw-dgt-160482",
  "languages": [
    "zh"
  ],
  "last_updated": "2025-09-17",
  "licence": "政府資料開放授權條款-第1版",
  "licence_type": [
    "other"
  ],
  "link_health": {
    "checked": "2026-10-01"
  },
  "maturity": "active",
  "name": "高雄市政府消防局地下式消防栓 [fire, police and emergency services and drinking water supply]",
  "notes": "Harvested from the Taiwan Government Open Data Platform bulk catalogue export on 2026-09-30 as part of the Asia-Pacific country search.",
  "provider": "高雄市政府消防局",
  "regions": [
    "高雄市政府消防局"
  ],
  "related_ids": [
    "data-tw-dgt-portal"
  ],
  "sectors": [
    "services.emergency_services",
    "water.drinking_water"
  ],
  "simulation_uses": [
    "capacity_planning"
  ],
  "sources": [
    {
      "accessed": "2026-09-30",
      "note": "Taiwan Government Open Data Platform catalogue entry read through the bulk catalogue export on 2026-09-30: title, description, tags, licence, formats, dates; the data files were not opened",
      "url": "https://data.gov.tw/dataset/160482"
    }
  ],
  "tags": [
    "Government Open Data Platform of Taiwan (data.gov.tw)",
    "生活安全及品質"
  ],
  "title_en": "Kaohsiung City Fire Bureau: Underground fire hydrants",
  "type": "data"
}
