{
  "access_links": [
    {
      "kind": "download",
      "label": "CONS.zip (2.2 MB)",
      "note": "Direct link from the Zenodo API, 2026-10-01",
      "url": "https://zenodo.org/records/5529710/files/CONS.zip?download=1"
    },
    {
      "kind": "download",
      "label": "NUTS3 2010-2019.zip (24 MB)",
      "note": "Direct link from the Zenodo API, 2026-10-01",
      "url": "https://zenodo.org/records/5529710/files/NUTS3%202010-2019.zip?download=1"
    },
    {
      "kind": "download",
      "label": "NUTS1 2010-2019.zip (2.2 MB)",
      "note": "Direct link from the Zenodo API, 2026-10-01",
      "url": "https://zenodo.org/records/5529710/files/NUTS1%202010-2019.zip?download=1"
    },
    {
      "kind": "download",
      "label": "NUTS2 2010-2019.zip (5.8 MB)",
      "note": "Direct link from the Zenodo API, 2026-10-01",
      "url": "https://zenodo.org/records/5529710/files/NUTS2%202010-2019.zip?download=1"
    },
    {
      "kind": "portal",
      "label": "SciGRID_gas: Consumption of EU (Nuts1, Nut2 and Nuts3)",
      "url": "https://doi.org/10.5281/zenodo.4922515"
    },
    {
      "kind": "docs",
      "label": "Gas network datasets on the openmod wiki",
      "url": "https://wiki.openmod-initiative.org/wiki/Gas_network_datasets"
    }
  ],
  "access_restrictions": "none",
  "continents": [
    "europe"
  ],
  "cost": "free",
  "data_family": [
    "system_description"
  ],
  "data_kind": [
    "network_topology"
  ],
  "date_catalogued": "2026-09-29",
  "date_verified": "2026-10-01",
  "dedupe_keys": {
    "name": "scigrid gas consumption of eu nuts1 nut2 and nuts3",
    "url": "doi:10.5281/zenodo.4922515"
  },
  "description": "SciGRID_gas: Consumption of EU (Nuts1, Nut2 and Nuts3) is a data resource listed in openmod Initiative wiki, a community wiki of open energy models and data under the section \"Gas network datasets > Natural Gas Demand\", published or maintained by doi.org (publisher inferred from the link). Consumption of EU countries: C.zip C.zip SciGRIDgas: Consumption of EU (Nuts1, Nut2 and Nuts3). Coverage: as stated on the linked page. The openmod wiki page \"Gas network datasets\" lists it under \"Natural Gas Demand\". It is reached through the links recorded on this page, with the catalogue entry as the discovery route. Access is free of charge and open. The licence is not stated on the wiki page (source page not read). Caveats: this record was written from the catalogue listing only, so the linked page was not opened, its contents and current availability were not checked, and the description may lag the source. It can support gas network inputs to energy-system models. Related record: the catalogue-level record data-openmod-initiative-wiki.",
  "description_checked": "2026-09-29",
  "discovery_routes": [
    {
      "date": "2026-09-29",
      "query": "openmod wiki page Gas network datasets",
      "route": "R06",
      "source": "openmod-wiki-mediawiki-api"
    }
  ],
  "formats": [
    "web_page"
  ],
  "geographic_scope": "continental",
  "homepage": "https://doi.org/10.5281/zenodo.4922515",
  "id": "data-openmod-gas-network-datasets-scigrid-gas-consumption-of-eu-nuts1-nut2-and",
  "languages": [
    "en"
  ],
  "last_updated": "2021-06-29",
  "licence": "CC-BY-4.0",
  "licence_type": [
    "attribution"
  ],
  "link_health": {
    "checked": "2026-10-01"
  },
  "maturity": "stale",
  "name": "SciGRID_gas: Consumption of EU (Nuts1, Nut2 and Nuts3)",
  "notes": "Harvested from a data page of the openmod wiki on 2026-09-29 at the user's request to include every entry of the related catalogues.",
  "provider": "doi.org (publisher inferred from the link)",
  "related_ids": [
    "data-openmod-initiative-wiki"
  ],
  "sectors": [
    "energy.gas_hydrogen"
  ],
  "simulation_uses": [
    "capacity_planning"
  ],
  "sources": [
    {
      "accessed": "2026-09-29",
      "note": "openmod Initiative wiki listing read on 2026-09-29: name, link, section, tags and any blurb; the linked page itself was not opened",
      "url": "https://wiki.openmod-initiative.org/wiki/Gas_network_datasets"
    }
  ],
  "tags": [
    "openmod Initiative wiki",
    "gas network"
  ],
  "title_en": "SciGRID: gas: Consumption of EU (Nuts1, Nut2 and Nuts3)",
  "type": "data"
}
