{
  "access_links": [
    {
      "kind": "download",
      "label": "TXT resource (Department of Water and Environmental Regulation)",
      "note": "answers 200 on 2026-10-01: file answers: application/octet-stream 20816 bytes",
      "url": "https://catalogue.data.wa.gov.au/dataset/53ccbfc7-4e2c-4948-aeba-b72c15ac7201/resource/3b8204e9-a712-4275-84df-1996c12b509d/download/gda2020_db.gisdba.fpm_flood_levels.met"
    },
    {
      "kind": "api",
      "label": "WFS resource (Department of Water and Environmental Regulation)",
      "note": "answers 200 on 2026-10-01: OGC WFS capabilities, 55 layers/types",
      "url": "https://public-services.slip.wa.gov.au/public/services/SLIP_Public_Services/Water_FS/MapServer/WFSServer"
    },
    {
      "kind": "portal",
      "label": "Dataset page on data.gov.au (Department of Water and Environmental Regulation)",
      "note": "CKAN package lists 7 resources",
      "url": "https://data.gov.au/data/dataset/fpm-flood-level-points"
    }
  ],
  "access_restrictions": "none",
  "continents": [
    "oceania"
  ],
  "cost": "free",
  "countries": [
    "AU"
  ],
  "data_family": [
    "hazards"
  ],
  "data_kind": [
    "asset_inventory"
  ],
  "date_catalogued": "2026-09-30",
  "date_verified": "2026-10-01",
  "dedupe_keys": {
    "name": "fpm flood level points m ahd dwer 019",
    "url": "https://data.sa.gov.au/data/dataset/fpm-flood-level-points"
  },
  "description": "FPM Flood Level Points (m AHD) (DWER-019) is a dataset listed in South Australian Government data directory (data.sa.gov.au), Australia, an open data portal, published or maintained by Department of Water and Environmental Regulation. The Department of Water and Environmental Regulation produces floodplain mapping of rivers and major watercourses and provides floodplain development advice to ensure that proposed floodplain development has adequate flood protection and does not impact on the existing flood regime of the area. This advice is related to major river flooding only. Coverage: South Australia. The portal files it under the publisher Department of Water and Environmental Regulation. Its tags are DWER, Flood, Hazards, Water. It offers 7 resource(s) in api arcgis server map service, fgdb, geojson, geopackage, shp. The portal shows 2026-09-30 as the last metadata change. It is reached through the links recorded on this page, with the catalogue entry as the discovery route. Access is free of charge and open. The licence is custom_active_acceptance. Caveats: this record was written from the catalogue listing only, so the linked page was not opened, its contents and current availability were not checked, and the description may lag the source. It can support infrastructure hazard and exposure studies. Related record: the catalogue-level record data-ditrdcsa-data-sa.",
  "description_checked": "2026-09-30",
  "discovery_routes": [
    {
      "date": "2026-09-30",
      "query": "CKAN package_search with infrastructure and hazard phrases in English and the national language",
      "route": "R02",
      "source": "South Australian Government Data Directory-ckan-api"
    }
  ],
  "formats": [
    "ogc_map_service",
    "api",
    "esri_geodatabase",
    "geojson",
    "geopackage",
    "shapefile",
    "plain_text"
  ],
  "geographic_scope": "regional",
  "hazards": [
    "flood"
  ],
  "homepage": "https://data.gov.au/data/dataset/fpm-flood-level-points",
  "id": "data-au-sa-fpm-flood-level-points",
  "languages": [
    "en"
  ],
  "last_updated": "2026-09-30",
  "licence": "custom_active_acceptance",
  "licence_type": [
    "other"
  ],
  "link_health": {
    "checked": "2026-10-01",
    "dead": [
      "https://data.sa.gov.au/data/api/3/action/package_show?id=53ccbfc7-4e2c-4948-aeba-b72c15ac7201",
      "https://data.sa.gov.au/data/dataset/fpm-flood-level-points"
    ],
    "dead_since": "2026-10-01"
  },
  "maturity": "active",
  "name": "FPM Flood Level Points (m AHD) (DWER-019)",
  "notes": "Harvested from the South Australian Government Data Directory CKAN API on 2026-09-30 as part of the Asia-Pacific country search.",
  "provider": "Department of Water and Environmental Regulation",
  "regions": [
    "South Australia"
  ],
  "related_ids": [
    "data-ditrdcsa-data-sa"
  ],
  "sectors": [
    "cross_cutting.multi_sector"
  ],
  "simulation_uses": [
    "hazard_exposure"
  ],
  "sources": [
    {
      "accessed": "2026-09-30",
      "note": "South Australian Government Data Directory catalogue entry read through the CKAN API on 2026-09-30: title, description, tags, licence, formats, dates; the data files were not opened",
      "url": "https://data.sa.gov.au/data/api/3/action/package_show?id=53ccbfc7-4e2c-4948-aeba-b72c15ac7201"
    }
  ],
  "tags": [
    "South Australian Government data directory (data.sa.gov.au), Australia",
    "hazard data",
    "DWER",
    "Flood",
    "Hazards",
    "Water"
  ],
  "title_en": "FPM Flood Level Points (m AHD) (DWER-019)",
  "type": "data"
}
