{
  "access_links": [
    {
      "kind": "portal",
      "label": "Publisher landing page",
      "url": "https://data.europa.eu/data/datasets/urn-isogeo-metadata-uuid-bfa49cb3-a18f-48c1-bc96-c7470181c487?locale=en"
    }
  ],
  "access_restrictions": "none",
  "continents": [
    "europe"
  ],
  "cost": "free",
  "countries": [
    "FR"
  ],
  "data_family": [
    "system_description"
  ],
  "data_kind": [
    "tabular"
  ],
  "date_catalogued": "2026-09-30",
  "date_verified": "2026-10-01",
  "dedupe_keys": {
    "name": "assainissement eaux usees chambres de raccordement communaute urbaine de dunkerque",
    "url": "https://data.europa.eu/data/datasets/urn-isogeo-metadata-uuid-bfa49cb3-a18f-48c1-bc96-c7470181c487?locale=en"
  },
  "description": "Assainissement - Eaux Usées : Chambres de Raccordement - Communauté Urbaine de Dunkerque is a dataset listed in Geocatalogue France, a catalogue harvested into the European data portal, published or maintained by BUREAU DE RECHERCHES GÉOLOGIQUES ET MINIÈRES. Of Community management, the sewerage network is described in the GIS by 64 layers of information. Separative wastewater collection network. Connection chambers for network segments. Coverage: FR. The portal shows the English title as \"Sanitation - Wastewater: Connecting Rooms - Dunkirk Urban Community\" (machine-translated by the portal). Its keywords include réseaux humides, assainissement. The listing shows 2021-08-30 as the last modification. It is reached through the links recorded on this page, with the catalogue entry as the discovery route. Access is free of charge and open. The licence is not stated on the portal listing (dataset page not read). Caveats: this record was written from the catalogue listing only, so the linked page was not opened, its contents and current availability were not checked, and the description may lag the source. It can support water network and flood-defence studies. Related record: the catalogue-level record data-eu-geocatalogue-fr.",
  "description_checked": "2026-09-30",
  "discovery_routes": [
    {
      "date": "2026-09-30",
      "query": "multilingual title search of the catalogue",
      "route": "R02",
      "source": "data.europa.eu-hub-search-api"
    }
  ],
  "formats": [
    "not_stated"
  ],
  "geographic_scope": "regional",
  "homepage": "https://data.europa.eu/data/datasets/urn-isogeo-metadata-uuid-bfa49cb3-a18f-48c1-bc96-c7470181c487?locale=en",
  "id": "data-geocatalogue-fr-assainissement-eaux-usees-chambres-de-raccordement-communaute-urbaine",
  "languages": [
    "fr"
  ],
  "last_updated": "2021-08-30",
  "licence": "not stated on the portal listing (dataset page not read)",
  "licence_type": [
    "not_stated"
  ],
  "link_health": {
    "checked": "2026-10-01"
  },
  "maturity": "stale",
  "name": "Assainissement - Eaux Usées : Chambres de Raccordement - Communauté Urbaine de Dunkerque",
  "notes": "Found by the Europe country search on 2026-09-30: title in the original language names an infrastructure element or a natural hazard.",
  "provider": "BUREAU DE RECHERCHES GÉOLOGIQUES ET MINIÈRES",
  "related_ids": [
    "data-eu-geocatalogue-fr"
  ],
  "sectors": [
    "water.wastewater"
  ],
  "simulation_uses": [
    "network_flow"
  ],
  "sources": [
    {
      "accessed": "2026-09-30",
      "note": "Geocatalogue France entry read through the European data portal search API on 2026-09-30: title, description, keywords, licence, dates and links; the data files were not opened",
      "url": "https://www.geocatalogue.fr"
    }
  ],
  "tags": [
    "Geocatalogue France",
    "wastewater"
  ],
  "title_en": "Sanitation - Wastewater: Connecting Rooms - Dunkirk Urban Community",
  "type": "data"
}
