{
  "access_links": [
    {
      "kind": "download",
      "label": "Download",
      "url": "https://data.london.gov.uk/download/2nlqm/81fb6b31-f6b2-4e12-b054-090319faec7b/PV%20Data.zip"
    },
    {
      "kind": "download",
      "label": "Download",
      "url": "https://data.london.gov.uk/download/2nlqm/b4a7e790-8cb8-451c-b828-c4c5d8445705/Weather%20Data%202014-11-30.xlsx"
    },
    {
      "kind": "portal",
      "label": "Publisher landing page",
      "url": "https://data.europa.eu/data/datasets/2nlqm?locale=en"
    }
  ],
  "access_restrictions": "none",
  "continents": [
    "europe"
  ],
  "cost": "free",
  "countries": [
    "GB"
  ],
  "data_family": [
    "system_description"
  ],
  "data_kind": [
    "survey"
  ],
  "date_catalogued": "2026-09-30",
  "date_verified": "2026-10-01",
  "dedupe_keys": {
    "name": "photovoltaic pv solar panel energy generation data",
    "url": "https://data.europa.eu/data/datasets/2nlqm?locale=en"
  },
  "description": "Photovoltaic (PV) Solar Panel Energy Generation data is a dataset listed in London Datastore, a catalogue harvested into the European data portal, published or maintained by UK Power Networks. This dataset contains voltage, current, power, energy, and weather data from low-voltage substations and domestic premises with high uptake of solar photovoltaic (PV) embedded generation. Data collected as part of the project run by UK Power Networks. Validation of Photovoltaic Connection Assessment Tool The project collected a dataset at domestic sites with Solar Panels. Coverage: UK Power Networks. The publisher named on the listing is UK Power Networks. It is reached through the links recorded on this page, with the catalogue entry as the discovery route. Access is free of charge and open. The licence is Creative Commons Attribution. Caveats: this record was written from the catalogue listing only, so the linked page was not opened, its contents and current availability were not checked, and the description may lag the source. It can support energy network and generation-capacity studies. Related record: the catalogue-level record data-eu-london-datastore.",
  "description_checked": "2026-09-30",
  "discovery_routes": [
    {
      "date": "2026-09-30",
      "query": "multilingual title search of the catalogue",
      "route": "R02",
      "source": "data.europa.eu-hub-search-api"
    }
  ],
  "formats": [
    "spreadsheet"
  ],
  "geographic_scope": "regional",
  "homepage": "https://data.europa.eu/data/datasets/2nlqm?locale=en",
  "id": "data-london-datastore-photovoltaic-pv-solar-panel-energy-generation-data",
  "languages": [
    "en"
  ],
  "licence": "Creative Commons Attribution",
  "licence_type": [
    "attribution"
  ],
  "link_health": {
    "checked": "2026-10-01"
  },
  "maturity": "not_stated",
  "name": "Photovoltaic (PV) Solar Panel Energy Generation data",
  "notes": "Found by the Europe country search on 2026-09-30: title in the original language names an infrastructure element or a natural hazard.",
  "provider": "UK Power Networks",
  "regions": [
    "UK Power Networks"
  ],
  "related_ids": [
    "data-eu-london-datastore"
  ],
  "sectors": [
    "energy.electricity"
  ],
  "simulation_uses": [
    "capacity_planning"
  ],
  "sources": [
    {
      "accessed": "2026-09-30",
      "note": "London Datastore entry read through the European data portal search API on 2026-09-30: title, description, keywords, licence, dates and links; the data files were not opened",
      "url": "https://data.london.gov.uk"
    }
  ],
  "tags": [
    "London Datastore",
    "electricity"
  ],
  "title_en": "Photovoltaic (PV) Solar Panel Energy Generation data",
  "type": "data"
}
