{
  "access_links": [
    {
      "kind": "portal",
      "label": "First dataset of the collection on the European data portal",
      "url": "https://data.europa.eu/data/datasets/r_emiro-2016-05-03t104233?locale=en"
    },
    {
      "kind": "portal",
      "label": "Linea di Costa - Linea di costa 1998",
      "url": "https://data.europa.eu/data/datasets/r_emiro-2017-09-29t123647?locale=en"
    },
    {
      "kind": "portal",
      "label": "Linea di Costa - Linea di costa 2011",
      "url": "https://data.europa.eu/data/datasets/r_emiro-2014-10-17t142101?locale=en"
    },
    {
      "kind": "portal",
      "label": "Linea di Costa - Linea di costa 2020_OB",
      "url": "https://data.europa.eu/data/datasets/r_emiro-2023-04-20t114434?locale=en"
    }
  ],
  "access_restrictions": "none",
  "continents": [
    "europe"
  ],
  "cost": "free",
  "countries": [
    "IT"
  ],
  "data_family": [
    "hazards"
  ],
  "data_kind": [
    "tabular",
    "network_topology"
  ],
  "date_catalogued": "2026-09-30",
  "date_verified": "2026-10-01",
  "dedupe_keys": {
    "name": "mappegis regione emilia romagna it coastal flood and storm surge hazard datasets",
    "url": "https://data.europa.eu/data/datasets/r_emiro-2016-05-03t104233?locale=en"
  },
  "description": "mappegis.regione.emilia-romagna.it: coastal flood and storm surge hazard datasets is a collection of datasets listed in Italian Catalogue of metadata for Spatial Data, a catalogue harvested into the European data portal, published or maintained by mappegis.regione.emilia-romagna.it. Coverage: the area served by mappegis.regione.emilia-romagna.it. The listing groups 4 datasets under this publisher or service host whose titles are about coastal flood and storm surge hazard; the first few are linked and all are named in the audit file. Examples: DBTR2013 - Linea di costa marina - (COS_GLI); Linea di Costa - Linea di costa 1998; Linea di Costa - Linea di costa 2011; Linea di Costa - Linea di costa 2020_OB. Formats seen: WMS. It is reached through the links recorded on this page, with the catalogue entry as the discovery route. Access is free of charge and open. The licence is not stated on the portal listing (dataset page not read). Caveats: this record was written from the catalogue listing only, so the linked page was not opened, its contents and current availability were not checked, and the description may lag the source. It can support hazard exposure and risk screening studies. Related record: the catalogue-level record data-eu-rndt.",
  "description_checked": "2026-09-30",
  "discovery_routes": [
    {
      "date": "2026-09-30",
      "query": "multilingual title search of the catalogue",
      "route": "R02",
      "source": "data.europa.eu-hub-search-api"
    }
  ],
  "formats": [
    "ogc_map_service"
  ],
  "geographic_scope": "regional",
  "hazards": [
    "coastal_flood_storm_surge"
  ],
  "homepage": "https://data.europa.eu/data/datasets/r_emiro-2016-05-03t104233?locale=en",
  "id": "data-rndt-mappegis-regione-emilia-romagna-it-hazard-coastal-flood-storm-surge",
  "languages": [
    "it"
  ],
  "last_updated": "2023-01-01",
  "licence": "not stated on the portal listing (dataset page not read)",
  "licence_type": [
    "not_stated"
  ],
  "link_health": {
    "checked": "2026-10-01"
  },
  "maturity": "stale",
  "name": "mappegis.regione.emilia-romagna.it: coastal flood and storm surge hazard datasets",
  "notes": "Collection of 4 datasets grouped into one record on 2026-09-30 (three or more datasets of one publisher or service host on one topic); the datasets are named in audit/eu-rndt.csv.",
  "provider": "mappegis.regione.emilia-romagna.it",
  "related_ids": [
    "data-eu-rndt"
  ],
  "sectors": [
    "cross_cutting.multi_sector"
  ],
  "simulation_uses": [
    "hazard_exposure"
  ],
  "sources": [
    {
      "accessed": "2026-09-30",
      "note": "Italian Catalogue of metadata for Spatial Data entries read through the European data portal search API on 2026-09-30: titles, descriptions, licences, dates and links; the data files were not opened",
      "url": "https://www.rndt.gov.it"
    }
  ],
  "tags": [
    "Italian Catalogue of metadata for Spatial Data",
    "coastal flood and storm surge hazard",
    "collection of datasets",
    "coastal_flood_storm_surge"
  ],
  "title_en": "Mappegis.regione.emilia-romagna.it: coastal flood and storm surge hazard datasets",
  "type": "data"
}
