{
  "access_links": [
    {
      "kind": "portal",
      "label": "datos.gob.cl dataset page",
      "url": "https://datos.gob.cl/dataset/categoria-geoespacial-instalaciones-y-edificaciones"
    },
    {
      "kind": "api",
      "label": "portal metadata (API)",
      "url": "https://datos.gob.cl/api/3/action/package_show?id=e2850076-df7a-416c-bdd5-775362e45c21"
    }
  ],
  "access_restrictions": "none",
  "continents": [
    "south_america"
  ],
  "cost": "free",
  "countries": [
    "CL"
  ],
  "data_family": [
    "system_description"
  ],
  "data_kind": [
    "asset_inventory",
    "tabular"
  ],
  "date_catalogued": "2026-09-30",
  "date_verified": "2026-10-01",
  "dedupe_keys": {
    "name": "categoria geoespacial instalaciones y edificaciones",
    "url": "https://datos.gob.cl/dataset/categoria-geoespacial-instalaciones-y-edificaciones"
  },
  "description": "Categoría Geoespacial: Instalaciones y edificaciones is a dataset listed in Chilean national open data portal (datos.gob.cl), an open data portal, published or maintained by Infraestructura de Datos Geoespaciales de Chile. Fichas de metadatos publicadas en el Geoportal de Chile. Esta categoría incluye una amplia gama de temas, como red aeroportuaria, red vial, establecimientos de educación, establecimientos de salud, etc. Coverage: Chile. The portal files it under the publisher Infraestructura de Datos Geoespaciales de Chile. Its tags are Instalaciones, edificaciones, establecimientos de educación, establecimientos de salud, red aeroportuaria. It offers 8 resource(s) in HTML, SHP. The portal shows 2024-06-05 as the last update. It is reached through the links recorded on this page, with the catalogue entry as the discovery route. Access is free of charge and open. The licence is CC-BY (version not stated). Caveats: this record was written from the catalogue listing only, so the linked page was not opened, its contents and current availability were not checked, and the description may lag the source. It can support infrastructure planning and operations studies. Related record: the catalogue-level record data-am-cl-portal.",
  "description_checked": "2026-09-30",
  "discovery_routes": [
    {
      "date": "2026-09-30",
      "query": "CKAN package_search in English, Spanish, Portuguese and French; the title names an infrastructure element or a natural hazard",
      "route": "R02",
      "source": "datos.gob.cl-ckan-api"
    }
  ],
  "formats": [
    "web_page",
    "shapefile"
  ],
  "geographic_scope": "national",
  "homepage": "https://datos.gob.cl/dataset/categoria-geoespacial-instalaciones-y-edificaciones",
  "id": "data-am-cl-categoria-geoespacial-instalaciones-y-edificaciones",
  "languages": [
    "es"
  ],
  "last_updated": "2024-06-05",
  "licence": "CC-BY (version not stated)",
  "licence_type": [
    "attribution"
  ],
  "link_health": {
    "checked": "2026-10-01"
  },
  "maturity": "stale",
  "name": "Categoría Geoespacial: Instalaciones y edificaciones",
  "notes": "Harvested from the datos.gob.cl CKAN API on 2026-09-30 in the Americas country search.",
  "provider": "Infraestructura de Datos Geoespaciales de Chile",
  "related_ids": [
    "data-am-cl-portal"
  ],
  "sectors": [
    "built_environment.buildings"
  ],
  "simulation_uses": [
    "hazard_exposure"
  ],
  "sources": [
    {
      "accessed": "2026-09-30",
      "note": "datos.gob.cl catalogue entry read through the CKAN API on 2026-09-30: title, description, tags, licence, formats, dates; the data files were not opened",
      "url": "https://datos.gob.cl/api/3/action/package_show?id=e2850076-df7a-416c-bdd5-775362e45c21"
    }
  ],
  "tags": [
    "Chilean national open data portal (datos.gob.cl)",
    "Instalaciones",
    "edificaciones",
    "establecimientos de educación",
    "establecimientos de salud"
  ],
  "title_en": "Geospatial category: Installations and buildings",
  "type": "data"
}
